{
  "schema_version": "harness-module/v1",
  "module_id": "memory",
  "module_version": "1.0.0",
  "classification_owner": "memory",
  "kind": "capability",
  "description": "Optional candidate archive, inbox, prompt hooks and explicit historical diagnostics; legacy repair is retired.",
  "default_activation": false,
  "dependencies": {
    "kernel_api": "v1",
    "modules": [
      "entry-kernel"
    ]
  },
  "requested_capabilities": [
    "filesystem-read",
    "filesystem-write",
    "process-execution",
    "task-state-read"
  ],
  "ownership": {
    "owned_paths": [
      "modules/memory/**",
      "runtime-hooks/memory/**",
      "scripts/append-runtime-inbox.ps1",
      "scripts/archive-memory-candidates.ps1",
      "scripts/check-shared-memory-layers.ps1",
      "scripts/memory-health-report.ps1",
      "scripts/memory-health.ps1",
      "scripts/memory-maintain.ps1",
      "scripts/repair-shared-memory.ps1",
      "scripts/resolve-obsidian-memory-script.ps1",
      "scripts/triage-runtime-inbox.ps1",
      "skills/obsidian-memory/**",
      "tests/verify-archive-memory-candidates.ps1",
      "tests/verify-memory-health-report.ps1",
      "tests/verify-memory-maintain.ps1",
      "tests/verify-memory-provider-boundary.ps1",
      "tests/verify-runtime-inbox.ps1",
      "tests/verify-triage-runtime-inbox.ps1",
      "vault-template/MEMORY.md"
    ],
    "watch_paths": [
      "scripts/lib/Harness.RuntimeDefault.psm1",
      "scripts/lib/Harness.TaskState.psm1"
    ]
  },
  "package": {
    "code": [
      "runtime-hooks/memory/**",
      "scripts/append-runtime-inbox.ps1",
      "scripts/archive-memory-candidates.ps1",
      "scripts/check-shared-memory-layers.ps1",
      "scripts/memory-health-report.ps1",
      "scripts/memory-health.ps1",
      "scripts/memory-maintain.ps1",
      "scripts/repair-shared-memory.ps1",
      "scripts/resolve-obsidian-memory-script.ps1",
      "scripts/triage-runtime-inbox.ps1",
      "skills/obsidian-memory/scripts/**"
    ],
    "schemas": [],
    "tests": [
      "tests/verify-archive-memory-candidates.ps1",
      "tests/verify-memory-health-report.ps1",
      "tests/verify-memory-maintain.ps1",
      "tests/verify-memory-provider-boundary.ps1",
      "tests/verify-runtime-inbox.ps1",
      "tests/verify-triage-runtime-inbox.ps1"
    ],
    "install_assets": [
      "skills/obsidian-memory/SKILL.md",
      "vault-template/MEMORY.md"
    ]
  },
  "exports": {
    "commands": [
      "scripts/memory-health.ps1",
      "scripts/memory-maintain.ps1",
      "scripts/repair-shared-memory.ps1",
      "scripts/triage-runtime-inbox.ps1"
    ],
    "hooks": [
      "runtime-hooks/memory/userpromptsubmit.js"
    ],
    "libraries": []
  },
  "validation": {
    "owner_tests": [
      "tests/verify-archive-memory-candidates.ps1",
      "tests/verify-memory-health-report.ps1",
      "tests/verify-memory-maintain.ps1",
      "tests/verify-memory-provider-boundary.ps1",
      "tests/verify-runtime-inbox.ps1",
      "tests/verify-triage-runtime-inbox.ps1"
    ],
    "quick": [],
    "core_groups": {},
    "changed": [
      "tests/verify-archive-memory-candidates.ps1",
      "tests/verify-memory-health-report.ps1",
      "tests/verify-memory-maintain.ps1",
      "tests/verify-memory-provider-boundary.ps1",
      "tests/verify-runtime-inbox.ps1",
      "tests/verify-triage-runtime-inbox.ps1",
      "tests/verify-v2-runtime-memory-decoupling.ps1"
    ],
    "full": [
      "tests/verify-archive-memory-candidates.ps1",
      "tests/verify-memory-health-report.ps1",
      "tests/verify-memory-maintain.ps1",
      "tests/verify-memory-provider-boundary.ps1",
      "tests/verify-runtime-inbox.ps1",
      "tests/verify-triage-runtime-inbox.ps1"
    ]
  }
}
